url,title,meta_description,n_headings,n_immagini,caratteri_testo
https://www.ronchiverdi.it/general-1,CONTATTACI | Ronchiverdi,"Hai domande o desideri maggiori informazioni sui nostri servizi? Siamo qui per aiutarti. Compila il modulo sottostante, inviaci un'email o chiamaci direttamente. Il nostro team è a tua disposizione per rispondere a tutte le tue richieste.",4,3,1059
https://www.ronchiverdi.it/reservations,Reservations | Ronchiverdi,,1,0,87
https://www.ronchiverdi.it/nuoto-young,NUOTO YOUNG | Ronchiverdi,"Scopri la nostra scuola di nuoto per bambini e ragazzi a Torino, con corsi adatti a tutte le età e livelli. Offriamo un programma educativo che favorisce lo sviluppo delle abilità acquatiche, la sicurezza in acqua e il divertimento. Un ambiente sicuro e stimolante per una crescita sana e sportiva.",1,5,2440
https://www.ronchiverdi.it/copia-di-kids,Copia di KIDS | Ronchiverdi,Vai alla pagina ufficiale kids per l'esperienza completa,14,14,3307
https://www.ronchiverdi.it/elements,ELEMENTS RESTAURANT | Ronchiverdi,": Situato nel cuore del club sportivo Ronchiverdi a Torino, Elements è un ristorante esclusivo che offre un'esperienza culinaria raffinata e salutare. Con una cucina che valorizza ingredienti freschi e di stagione, il menu propone piatti leggeri e gustosi, ideali per chi cerca un'alimentazione equilibrata.",9,7,527
https://www.ronchiverdi.it/ronchi-viaggi,RONCHI VIAGGI | Ronchiverdi,"Ronchi Viaggi è l'agenzia viaggi esclusiva di Ronchiverdi, pensata per offrire esperienze di viaggio personalizzate che uniscono business e piacere. Offriamo consulenze su misura, biglietteria aerea, marittima e ferroviaria, con un'attenzione particolare alle esigenze individuali di ogni cliente. Scopri come rendere unico il tuo prossimo viaggio con Ronchi Viaggi.",6,3,1078
https://www.ronchiverdi.it/privacy-lead-eventi,PRIVACY LEAD | Ronchiverdi,Qui puoi leggere la privacy policy completa relativamente al form che hai appena compilato. Scopri come Ronchiverdi tratta i tuoi dati,0,0,19530
https://www.ronchiverdi.it/home-sport,HOME | Ronchiverdi,"Scopri il nostro club sportivo esclusivo a Torino, situato in un'area di 35.000 metri quadrati tra indoor e outdoor. Offriamo una vasta gamma di attività per il benessere fisico e mentale, tra cui tennis, padel, nuoto, running, triathlon, fitness e allenamento funzionale. Le nostre strutture includono una palestra attrezzata, quattro piscine, nove campi da tennis, campi da padel e beach volley, oltre a un'area dedicata al benessere olistico e fisioterapico.",10,14,1107
https://www.ronchiverdi.it/relax-zone,RELAX ZONE  | Ronchiverdi,"Scopri un'oasi di benessere nel cuore di Torino. La nostra Relax Zone offre un'esperienza sensoriale unica, con bagni di vapore, sauna, Kneipp verticale e docce emozionali. Un ambiente raffinato e rilassante, ideale per rigenerarsi dopo l'attività fisica o per una pausa di puro relax.",4,5,1331
https://www.ronchiverdi.it/oronero,ORONERO | Ronchiverdi,"Un evento esclusivo che celebra l'eccellenza in vari settori, tra cui moda, bellezza, benessere e business. Oronero offre una giornata ricca di attività, consulenze personalizzate e opportunità di networking in un ambiente elegante e raffinato. Un'occasione unica per scoprire tendenze, innovazioni e soluzioni per il business, il tutto immersi nell'atmosfera esclusiva di Ronchiverdi.",8,9,3701
https://www.ronchiverdi.it/menu-serale,Menu | Ronchiverdi,,13,20,3516
https://www.ronchiverdi.it/padel,PADEL | Ronchiverdi,"Scopri i nostri 3 campi da padel, di cui 2 coperti e 1 all’aperto, disponibili per soci e non soci senza necessità di abbonamento. Offriamo corsi per adulti e bambini, eventi e tornei, il tutto in un ambiente esclusivo e immerso nel verde. Prenota facilmente tramite l’app Wansport e vivi l’esperienza del padel a Torino con Ronchiverdi.",6,5,2453
https://www.ronchiverdi.it/youngschool-soci,Kids Buy Soci | Ronchiverdi,,5,4,1554
https://www.ronchiverdi.it/tennis,TENNIS | Ronchiverdi,"Scopri il nostro club a Torino con 9 campi in terra rossa, di cui 6 coperti nel periodo invernale. Offriamo corsi per tutti i livelli, dalla scuola tennis ai programmi agonistici, con istruttori certificati FITP.",8,14,2500
https://www.ronchiverdi.it/copia-di-business,COMUNICAZIONI BUSINESS | Ronchiverdi,"Business Ronchiverdi è il punto di riferimento per aziende e professionisti a Torino, offrendo spazi esclusivi per eventi, incontri e networking. Con una location immersa nel verde, il club propone soluzioni personalizzate per meeting, team building e attività corporate, garantendo un ambiente stimolante e riservato.",1,3,1228
https://www.ronchiverdi.it/business-lounge,BUSINESS LOUNGE | Ronchiverdi,"Situata nel cuore del club, la Business Lounge offre un ambiente elegante e riservato, ideale per incontri professionali, riunioni e eventi aziendali. Con spazi privati, connessione internet veloce e servizio catering di alta qualità, ogni dettaglio è pensato per garantire comfort e produttività.",10,7,2862
https://www.ronchiverdi.it/copia-di-event,RONCHIVERDI SUMMER | Ronchiverdi,,0,0,0
https://www.ronchiverdi.it/lead-eventi,LEAD EVENTI | Ronchiverdi,"Partecipa a un evento Ronchiverdi e ricevi una giornata omaggio nel club sportivo più esclusivo di Torino. Scopri fitness, piscina, tennis e area wellness.",1,2,1650
https://www.ronchiverdi.it/menu-provvisorio,MENU PROVVISORIO | Ronchiverdi,Stiamo rinnovando le nostre cucine! Questo che vedi è il menù che sarà disponibile dall' 11 al 24 Agosto,8,2,1522
https://www.ronchiverdi.it/lead-eventi-elements,LEAD EVENTI ELEMENTS | Ronchiverdi,"Partecipa a un evento Ronchiverdi e ricevi un aperitivo in omaggio. 
Scopri la nostra cucina che rigenera e i nostri spazi costruiti su benessere e relax",1,2,1624
https://www.ronchiverdi.it/experience-details,Ronchiverdi,,0,0,0
https://www.ronchiverdi.it/abbonamenti,ABBONAMENTI | Ronchiverdi,"Scopri le nostre opzioni di abbonamento, pensate per offrirti l'accesso completo a tutte le nostre strutture e servizi esclusivi. Unisciti a Ronchiverdi per vivere l'esperienza di un club sportivo di alto livello, con vantaggi pensati per ogni esigenza. Approfitta della nostra offerta per il benessere e lo sport.",6,8,1252
