url,title,meta_description,n_headings,n_immagini,caratteri_testo
https://www.ronchiverdi.it/post/hyrox-cos-è-davvero-e-perché-torino-ne-sta-parlando,Hyrox: cos'è davvero e perché Torino ne sta parlando,,5,3,7949
https://www.ronchiverdi.it/post/trasforma-la-tua-nuotata-guida-essenziale-per-smettere-di-nuotare-a-caso-e-affinare-la-tecnica,Trasforma la tua Nuotata: Guida Essenziale per Smettere di Nuotare a Caso e Affinare la Tecnica,"Nuotare senza una tecnica precisa può sembrare rilassante, ma spesso significa sprecare energie e non migliorare davvero.",16,2,7727
https://www.ronchiverdi.it/post/allenarsi-forte-non-basta-come-evitare-di-rompere-il-tuo-asset-più-importante,Allenarsi ‘forte’ non basta: come evitare di rompere il tuo asset più importante,,6,3,6898
https://www.ronchiverdi.it/post/rieducazione-funzionale-scopri-come-tornare-ad-allenarti-e-riscoprire-il-benessere-totale,Rieducazione Funzionale: Scopri Come Tornare ad Allenarti e Riscoprire il Benessere Totale,Ritornare ad allenarti dopo un infortunio o un periodo di inattività non significa semplicemente riprendere gli esercizi di prima.,8,2,5911
https://www.ronchiverdi.it/post/pilates-reformer-il-dolce-che-ti-rende-più-forte-e-più-stabile,Pilates Reformer il ‘dolce’ che ti rende più forte (e più stabile),,6,3,6903
https://www.ronchiverdi.it/post/cosa-succede-al-tuo-corpo-quando-smetti-di-allenarti-per-2-settimane,Cosa succede al tuo corpo quando smetti di allenarti per 2 settimane,,5,3,5272
https://www.ronchiverdi.it/post/lezioni-tennis-gruppo-o-individuale-la-risposta-che-nessuno-ti-dà,Lezioni tennis: gruppo o individuale? La risposta che nessuno ti dà,,9,3,10490
https://www.ronchiverdi.it/post/aquastep-sembra-solo-acqua-poi-lo-provi-e-capisci,AquaStep: sembra “solo” acqua… poi lo provi e capisci,Hai mai pensato che allenarti in acqua potesse essere così intenso e allo stesso tempo delicato per il corpo?,5,3,6342
https://www.ronchiverdi.it/post/padel-a-torino-prenoti-online-e-giochi-meglio-se-segui-queste-regole,Padel a Torino: prenoti online e giochi meglio se segui queste regole,"Se stai cercando un modo semplice e divertente per migliorare il tuo gioco a padel a Torino, sei nel posto giusto.",12,3,5799
https://www.ronchiverdi.it/post/padel-a-torino-perché-è-lo-sport-più-smart-da-fare-adesso,Padel a Torino: perché è lo sport più smart da fare adesso,,5,3,5300
https://www.ronchiverdi.it/post/scopri-il-giusto-ordine-per-massimizzare-il-relax-nella-nostra-esclusiva-relax-zone-con-sauna-e-bagn,Scopri il Giusto Ordine per Massimizzare il Relax nella Nostra Esclusiva Relax Zone con Sauna e Bagno Turco,"Il relax non è mai stato così profondo come nella nostra Relax Zone, dove sauna, bagno turco e percorso Kneipp si combinano per offrire un’esperienza rigenerante unica.",6,2,6587
https://www.ronchiverdi.it/post/personal-trainer-torino-quando-ne-hai-davvero-bisogno-e-quando-no,Personal trainer Torino: quando ne hai davvero bisogno (e quando no),,5,3,6172
https://www.ronchiverdi.it/post/scopri-come-trasformare-il-tuo-allenamento-con-90-mq-di-area-funzionale-personalizzata,Scopri come trasformare il tuo allenamento con 90 mq di area funzionale personalizzata,"Immagina uno spazio di 90 metri quadrati dedicato esclusivamente a te e al tuo allenamento, dove ogni movimento conta e ogni esercizio è pensato per farti migliorare davvero.",7,2,5091
https://www.ronchiverdi.it/post/hyrox-svelato-la-guida-essenziale-per-affrontare-il-tuo-primo-workout-senza-paura,HYROX svelato: la guida essenziale per affrontare il tuo primo workout senza paura,"Se stai pensando di provare HYROX, probabilmente ti senti un po’ sopraffatto. Non sei solo. HYROX è un allenamento unico che combina corsa e esercizi funzionali in un formato competitivo, ma senza una guida chiara può sembrare difficile da affrontare.",9,2,5237
https://www.ronchiverdi.it/post/massaggio-terapeutico-o-sportivo-se-sbagli-scelta-perdi-metà-beneficio,"Massaggio terapeutico o sportivo? Se sbagli scelta, perdi metà beneficio",,12,3,7244
https://www.ronchiverdi.it/post/vuoi-risultati-più-rapidi-ecco-cosa-fa-davvero-un-personal-trainer-e-cosa-non-dovrebbe-fare,Vuoi risultati più rapidi? Ecco cosa fa davvero un Personal Trainer (e cosa NON dovrebbe fare),,14,3,7392
https://www.ronchiverdi.it/post/aquafitness-il-modo-più-sicuro-per-tonificare-tutto-il-corpo-senza-stress,Aquafitness il modo più ‘sicuro’ per tonificare tutto il corpo senza stress,L’acquafitness è una delle attività più efficaci e delicate per migliorare la forma fisica senza affaticare troppo il corpo.,9,3,7844
https://www.ronchiverdi.it/post/cascata-di-ghiaccio-dopo-la-sauna-ecco-perché-tutti-ne-parlano-e-come-usarla-bene,Cascata di ghiaccio dopo la sauna: ecco perché tutti ne parlano (e come usarla bene),,6,3,8892
https://www.ronchiverdi.it/blog,Blog | Ronchiverdi,,5,8,280
https://www.ronchiverdi.it/event-details/oronero-alchemy-partner,ORONERO ALCHEMY PARTNER | Ronchiverdi,"Un evento esclusivo dove 20 aziende e professionisti d’eccellenza daranno vita a esperienze uniche dedicate a bellezza, moda, design, business, food e lifestyle.
Aperitivo di Benvenuto & live Music alle ore 18:00
Light Dinner alle ore 19:30",4,2,851
https://www.ronchiverdi.it/event-details/four-elements-private-preview,Four Elements – Private Preview | Ronchiverdi,"Luci calde, sapori curati, musica avvolgente.
Dalle 20:30 una Private Preview tra cena, live show cooking, bevande incluse e DJ set live in stile Buddha Bar.",4,2,963
https://www.ronchiverdi.it/event-details/oronero-alchemy,ORONERO ALCHEMY | Ronchiverdi,"Un evento esclusivo dove 20 aziende e professionisti d’eccellenza daranno vita a esperienze uniche dedicate a bellezza, moda, design, business, food e lifestyle.
Aperitivo di Benvenuto & live Music alle ore 18:00
Light Dinner alle ore 19:30",4,2,842
https://www.ronchiverdi.it/event-details/4-elements,4 elements | Ronchiverdi,"Un’atmosfera ispirata allo stile Buddha-Bar, reinterpretata con l’eleganza contemporanea e il carattere distintivo di Elements Restaurant Ronchiverdi, dove atmosfera e proposta gastronomica
si fondono in un’esperienza raffinata e coinvolgente.
food stations | show cooking | live music",4,3,890
https://www.ronchiverdi.it/event-details/papa-power-day,Papà Power Day  | Ronchiverdi,"19 marzo: vivi gratuitamente l’esperienza Ronchiverdi con il tuo papà.
Sport, benessere e relax",4,3,284
https://www.ronchiverdi.it/event-details/business-match-2025,BUSINESS MATCH 2025 | Ronchiverdi,Non perdere l'occasione di creare partnership significative e di esplorare nuove opportunità di crescita e collaborazione,7,2,863
https://www.ronchiverdi.it/event-details/4-elements-2,4 elements | Ronchiverdi,"Una serata dal fascino suggestivo, tra dettagli curati, musica e proposta gastronomica, reinterpretata con l’eleganza contemporanea di Elements Restaurant, dove atmosfera e proposta gastronomica si fondono in un’esperienza raffinata e coinvolgente.
food stations | show cooking | live music",4,2,969
https://www.ronchiverdi.it/event-details/mom-wellness-experience,Mom Wellness Experience | Ronchiverdi,"8,9,10 maggio: vivi gratuitamente l’esperienza Ronchiverdi con la tua mamma.
Tu ti prendi cura di lei, noi ci prendiamo cura di voi.",4,3,343
https://www.ronchiverdi.it/event-details/oronero-arte-in-passerella,ORONERO - ARTE IN PASSERELLA | Ronchiverdi,"Scopri l'eleganza dell'arte contemporanea con OroNero Arte in Passerella, un evento imperdibile che celebra la creatività e l'estetica sofisticata. Un'esperienza unica per immergersi nelle opere di artisti di spicco, attraverso sfilate e presentazioni esclusive.",6,2,1460
https://www.ronchiverdi.it/event-details/pasqua-ronchiverdi-elements,Pasqua Ronchiverdi Elements | Ronchiverdi,Tradizione e gusto | Live music experience,4,3,244
https://www.ronchiverdi.it/event-details/gala-sotto-le-stelle,GALA SOTTO LE STELLE | Ronchiverdi,"La serata si apre con 5 isole tematiche per l'aperitivo e cocktail espressi , prima di una cena servita con piatti ricercati: risotto con fiori di zucca e tartare di ricciola e il nostro ""Come un burger"" di polpo scottato.",6,2,1737
https://www.ronchiverdi.it/event-details/tennis-vibes-spritz-iscriviti-entro-giovedi-6-giugno,Tennis Vibes & Spritz - iscriviti entro giovedì 6 giugno | Ronchiverdi,Under 40 Tennis Party,4,3,252
https://www.ronchiverdi.it/event-details/4-elements-15-luglio,4 elements  - 15 luglio | Ronchiverdi,"Una serata dal fascino suggestivo, tra dettagli curati, musica e proposta gastronomica, reinterpretata con l’eleganza contemporanea di Elements Restaurant, dove atmosfera e proposta gastronomica si fondono in un’esperienza raffinata e coinvolgente.
food stations | show cooking | live music",6,2,1386
https://www.ronchiverdi.it/event-details/open-day-summer-sport-camp,open day Summer Sport Camp | Ronchiverdi,"Incontra il team, visita gli spazi, scopri le attività sportive e i laboratori creativi",4,3,288
https://www.ronchiverdi.it/event-details/san-valentino-2026,San Valentino 2026 | Ronchiverdi,Cena a lume di candela | Live music experience,4,3,239
https://www.ronchiverdi.it/event-details/4-elements-ospiti,4 elements - ospiti | Ronchiverdi,"Una serata dal fascino suggestivo, tra dettagli curati, musica e proposta gastronomica, reinterpretata con l’eleganza contemporanea di Elements Restaurant, dove atmosfera e proposta gastronomica si fondono in un’esperienza raffinata e coinvolgente.
food stations | show cooking | live music",4,2,978
https://www.ronchiverdi.it/event-details/ronchiverdi-christmas-event,Ronchiverdi Christmas Event | Ronchiverdi,"Un evento speciale dedicato al mondo Ronchiverdi, pensato per vivere una serata di shopping, spettacoli e atmosfere natalizie in una cornice raffinata. Un’esperienza immersiva che unisce musica, performance, degustazioni, experience e sconti dedicati in Rinascente.",5,2,865
https://www.ronchiverdi.it/event-details/4-elements-prevendita,4 elements - prevendita | Ronchiverdi,"Una serata dal fascino suggestivo, tra dettagli curati, musica e proposta gastronomica, reinterpretata con l’eleganza contemporanea di Elements Restaurant, dove atmosfera e proposta gastronomica si fondono in un’esperienza raffinata e coinvolgente.
food stations | show cooking | live music",6,2,1322
https://www.ronchiverdi.it/event-details/pasqua-2026,Pasqua 2026 | Ronchiverdi,Tradizione e gusto | Live music experience,4,3,228
https://www.ronchiverdi.it/event-details/papa-power-day-soci,Papà Power Day  - soci - | Ronchiverdi,"19 marzo: vivi gratuitamente l’esperienza Ronchiverdi con il tuo papà.
Sport, benessere e relax",4,3,294
https://www.ronchiverdi.it/service-page/prenota-un-tour,PRENOTA UN TOUR | Ronchiverdi,Ti accompagneremo a visitare il nostro club e risponderemo a tutte le tue domande,4,0,553
https://www.ronchiverdi.it/service-page/summer-experience,SUMMER EXPERIENCE | Ronchiverdi,,2,0,333
https://www.ronchiverdi.it/menu-serale?menu=martini-lounge,MARTINI LOUNGE | Ronchiverdi,Dal Martedì alla Domenica dalle 11:00 alle 17:00,8,3,1205
https://www.ronchiverdi.it/menu-serale?menu=menu-caffetteria,MENU CAFFETTERIA | Ronchiverdi,,8,3,3588
https://www.ronchiverdi.it/menu-serale?menu=menu-provvisorio,MENU PROVVISORIO | Ronchiverdi,Stiamo rinnovando le nostre cucine! Questo che vedi è il menù che sarà disponibile dall' 11 al 24 Agosto,9,3,1972
https://www.ronchiverdi.it/menu-serale?menu=carta-dei-vini,CARTA DEI VINI | Ronchiverdi,,10,57,4087
https://www.ronchiverdi.it/menu-serale?menu=menu,Menu | Ronchiverdi,,13,20,3516
https://www.ronchiverdi.it/portfolio-collections/my-portfolio/gym-floor,GYM FLOOR | Ronchiverdi,"Il Gym Floor è l'area dedicata all'allenamento individuale con macchinari Technogym. Spazi ampi, comfort e assistenza sempre disponibile per un workout personalizzato, efficace e accessibile a tutti, dal principiante all'atleta più esperto.",2,2,372
https://www.ronchiverdi.it/portfolio-collections/my-portfolio/group-class,GROUP CLASS | Ronchiverdi,"Le group class sono sessioni di allenamento di gruppo guidate da istruttori qualificati. Energia condivisa, motivazione collettiva e varietà di discipline per allenarsi in modo coinvolgente, divertente ed efficace, indipendentemente dal livello di preparazione. Trova i corsi che ti ispirano di più e allenati con noi",2,2,451
https://www.ronchiverdi.it/portfolio-collections/my-portfolio/lacertosus,LACERTOSUS | Ronchiverdi,"L'area funzionale di 90 mq è lo spazio ideale per allenamenti dinamici e versatili. Perfetta per esercizi a corpo libero, circuiti e piccoli attrezzi, favorisce libertà di movimento e personalizzazione in un ambiente stimolante, cool e sempre assistito.",2,2,386
https://www.ronchiverdi.it/portfolio-collections/my-portfolio,Il mio portfolio,Ti do il benvenuto nel mio portfolio. Qui troverai una selezione dei miei lavori. Scopri i miei progetti per saperne di più su ciò che faccio.,2,6,269
https://www.ronchiverdi.it/eventi-business,EVENTI BUSINESS | Ronchiverdi,"Organizza i tuoi eventi aziendali in una location esclusiva a Torino, immersa nel verde e a pochi minuti dal centro città. Offriamo spazi eleganti e versatili, come la Business Lounge e la Sala Congressi, ideali per meeting, workshop, conferenze e sessioni di networking. Il nostro team dedicato supporta ogni fase dell'organizzazione, offrendo servizi personalizzati tra cui catering, attrezzature audio/video e attività di team building.",8,7,2247
https://www.ronchiverdi.it/martini-lounge-pool,MARTINI LOUNGE POOL | Ronchiverdi,"Martini Lounge Ronchiverdi: Situata a bordo piscina nel cuore del club, la Martini Lounge offre un ambiente elegante e rilassante per gustare cocktail raffinati, aperitivi e piatti leggeri. Ideale per socializzare e godersi momenti di piacere in un contesto esclusivo",5,6,1520
https://www.ronchiverdi.it/coming-soon-02,LANDING SUMMER CAMP | Ronchiverdi,"Un'estate all'insegna dello sport, dell'apprendimento e del divertimento per bambini e ragazzi dai 3 ai 12 anni. Ogni settimana un'avventura diversa, esplorando culture, tradizioni e lingue attraverso attività sportive, laboratori creativi e giochi. Il programma include anche sessioni di inglese con il metodo Shenker, favorendo l'apprendimento in modo interattivo e coinvolgente.",1,2,463
https://www.ronchiverdi.it/orari,ORARI | Ronchiverdi,"Scopri gli orari di apertura del nostro Club sportivo a Torino, per usufruire dei nostri servizi e attività. Visita la nostra pagina per tutti i dettagli e pianifica la tua esperienza al meglio.",2,2,157
https://www.ronchiverdi.it/kids,SUMMER SPORT CAMP | Ronchiverdi,"Un'estate all'insegna dello sport, dell'apprendimento e del divertimento per bambini e ragazzi dai 3 ai 12 anni. Ogni settimana un'avventura diversa, esplorando culture, tradizioni e lingue attraverso attività sportive, laboratori creativi e giochi.",10,9,4410
https://www.ronchiverdi.it/video,VIDEO | Ronchiverdi,Esplora la nostra galleria multimediale con video esclusivi che raccontano l'esperienza unica offerta dal nostro club a Torino.,0,0,0
https://www.ronchiverdi.it/piscine,PISCINE | Ronchiverdi,"Scopri le nostre quattro piscine, coperte e scoperte, ideali per nuoto libero, allenamenti e corsi specializzati. Offriamo attività come aquafitness, hydrobike, aquatrekking e swim training, adatte a tutti i livelli. Un ambiente sicuro e stimolante per ogni appassionato di sport acquatici.",7,10,2723
https://www.ronchiverdi.it/business,BUSINESS | Ronchiverdi,"Business Ronchiverdi è il punto di riferimento per aziende e professionisti a Torino, offrendo spazi esclusivi per eventi, incontri e networking. Con una location immersa nel verde, il club propone soluzioni personalizzate per meeting, team building e attività corporate, garantendo un ambiente stimolante e riservato.",40,33,3104
https://www.ronchiverdi.it/orari-club,ORARI CLUB | Ronchiverdi,"Orari di apertura Ronchiverdi: Scopri gli orari di apertura del nostro Club sportivo a Torino, per usufruire dei nostri servizi e attività. Visita la nostra pagina per tutti i dettagli e pianifica la tua esperienza al meglio.",4,3,280
https://www.ronchiverdi.it/book-online,APPUNTAMENTI | Ronchiverdi,"Un'estate all'insegna del divertimento e dell'apprendimento per bambini e ragazzi. Ogni settimana, un viaggio in un nuovo Paese attraverso sport, laboratori creativi e attività educative. Il programma include sessioni di inglese con il metodo Shenker, giochi tematici e spettacoli finali. Un'esperienza unica per crescere, divertirsi e fare nuove amicizie",3,2,295
https://www.ronchiverdi.it/copia-di-orari-club,CONTACT FORM | Ronchiverdi,"Hai domande o desideri maggiori informazioni sui nostri servizi? Compila il modulo sottostante, inviaci un'email o chiamaci direttamente. Il nostro team è a tua disposizione per rispondere a tutte le tue richieste.",3,3,332
https://www.ronchiverdi.it/sport,SPORT | Ronchiverdi,"Scopri un club sportivo esclusivo a Torino che offre una vasta gamma di attività per il benessere fisico e mentale. Dai corsi di tennis, padel e triathlon, alle piscine indoor e outdoor, fino alle sale fitness e spinning, ogni spazio è pensato per soddisfare le diverse esigenze degli appassionati di sport. Un ambiente stimolante e professionale, ideale per chi cerca qualità e varietà nell'offerta sportiva.",3,9,490
https://www.ronchiverdi.it/carta-dei-vini,CARTA DEI VINI | Ronchiverdi,"Esplora la nostra selezione esclusiva di etichette italiane e internazionali, pensata per accompagnare ogni piatto con l'abbinamento perfetto. Dai grandi classici ai vini di nicchia, ogni bottiglia è scelta con cura per offrire un'esperienza enogastronomica unica. Scopri la nostra carta dei vini e lasciati guidare in un viaggio sensoriale senza pari.",8,55,3601
https://www.ronchiverdi.it/triathlon,TRIATHLON | Ronchiverdi,"Scopri il nostro programma di triathlon a Torino, dedicato a tutte le età e livelli. Offriamo allenamenti completi che combinano nuoto, ciclismo e corsa, con supporto tecnico qualificato e strutture all'avanguardia. Unisciti a noi per vivere la passione del triathlon in un ambiente stimolante e professionale.",5,10,2235
https://www.ronchiverdi.it/triathlon-young,TRIATHLON YOUNG | Ronchiverdi,"Scopri il nostro programma di triathlon per bambini e ragazzi, un'opportunità unica per allenarsi in un ambiente stimolante e sicuro. Nuoto, ciclismo e corsa per sviluppare le abilità sportive e divertirsi con i coetanei. Un percorso adatto a tutti i livelli.",1,3,1631
https://www.ronchiverdi.it/home-business,HOME BUSINESS  | Ronchiverdi,"Business Ronchiverdi è il punto di riferimento per aziende e professionisti a Torino, offrendo spazi esclusivi per eventi, incontri e networking. Con una location immersa nel verde, il club propone soluzioni personalizzate per meeting, team building e attività corporate, garantendo un ambiente stimolante e riservato.",6,7,648
https://www.ronchiverdi.it/padel-young,PADEL YOUNG | Ronchiverdi,"Un programma sportivo coinvolgente pensato per ragazzi e ragazze dai 10 ai 17 anni che desiderano avvicinarsi o perfezionarsi nel padel. Offriamo allenamenti settimanali in gruppi suddivisi per età e livello, guidati da istruttori qualificati. Ogni lezione è progettata per migliorare tecnica, gioco di squadra, reattività e strategia, con l’obiettivo di far crescere ogni giovane atleta sia sul piano sportivo che personale.",1,3,1044
https://www.ronchiverdi.it/caffetteria,CAFFETTERIA ELEMENTS | Ronchiverdi,"Situata all'interno del prestigioso club sportivo Ronchiverdi a Torino, la Caffetteria Elements offre un ambiente raffinato e rilassante per le tue pause quotidiane.",5,3,465
https://www.ronchiverdi.it/tennis-young,TENNIS YOUNG | Ronchiverdi,"Un programma formativo e competitivo pensato per bambini e ragazzi dai 4 ai 20 anni, che accompagna i giovani atleti dai primi colpi fino al perfezionamento tecnico e fisico. Offriamo corsi suddivisi per età e livello, con allenamenti settimanali e preparazione atletica specifica. Il nostro team di maestri qualificati FITP guida ogni giovane tennista in un ambiente sicuro e stimolante, favorendo la passione per lo sport e la crescita personale",4,8,3590
https://www.ronchiverdi.it/portfolio,Portfolio | Ronchiverdi,"Esplora i nostri progetti di successo, dalle collaborazioni aziendali agli eventi esclusivi, fino alle iniziative sportive e culturali. Ogni realizzazione riflette la nostra dedizione all'eccellenza e all'innovazione. Scopri come Ronchiverdi trasforma idee in esperienze indimenticabili.",1,6,162
https://www.ronchiverdi.it/event-list,Events | Ronchiverdi,,1,2,81
https://www.ronchiverdi.it/icone,ICONE | Ronchiverdi,Questa pagina raccoglie le icone necessarie al completamente dell'ecommerce,0,15,0
https://www.ronchiverdi.it/fitness,FITNESS | Ronchiverdi,"Scopri il nostro centro fitness all'avanguardia a Torino, dove allenarsi diventa un'esperienza unica. Offriamo spazi ampi e attrezzature moderne per soddisfare ogni esigenza, dal principiante all'atleta esperto. Le nostre aree includono il Gym Floor con macchinari Technogym, la Functional Area powered by Lacertosus per allenamenti ad alta intensità, e una vasta gamma di corsi di gruppo per tutti i livelli.",8,21,2639
https://www.ronchiverdi.it/martini-lounge,MARTINI LOUNGE | Ronchiverdi,"Martini Lounge Ronchiverdi: Situata a bordo piscina nel cuore del club, la Martini Lounge offre un ambiente elegante e rilassante per gustare cocktail raffinati, aperitivi e piatti leggeri. Ideale per socializzare e godersi momenti di piacere in un contesto esclusivo",7,3,990
https://www.ronchiverdi.it/running,RUNNING | Ronchiverdi,"Unisciti al nostro gruppo di corsa a Torino, dove atleti di tutti i livelli si allenano insieme in un ambiente stimolante e inclusivo. Offriamo sessioni settimanali di allenamento, partecipazione a gare locali e supporto da parte di esperti del settore. Che tu sia un principiante o un runner esperto, troverai il tuo posto nel nostro team.",5,7,2768
https://www.ronchiverdi.it/menu,Menu | Ronchiverdi,,11,19,3141
https://www.ronchiverdi.it/experiences,Experiences | Ronchiverdi,,1,0,12
https://www.ronchiverdi.it/upcoming-eventi-business,UPCOMING EVENTI BUSINESS | Ronchiverdi,"Scopri gli eventi in programma presso il nostro club a Torino. Dalle serate tematiche agli incontri professionali, offriamo un calendario ricco di appuntamenti pensati per ogni interesse. Unisciti a noi per vivere esperienze uniche in un ambiente esclusivo.",0,2,0
https://www.ronchiverdi.it/hyrox,HYROX | Ronchiverdi,"Partecipa alla competizione fitness più intensa del mondo, composta da 8 km di corsa e 8 stazioni di allenamento funzionale. Unisciti alla community globale di oltre 550.000 atleti e sfida te stesso in un ambiente stimolante e professionale. Preparati con i nostri allenamenti specifici e affronta la gara con determinazione.",8,8,3595
https://www.ronchiverdi.it/saauniversitywellness,SAA University & Wellness | Ronchiverdi,"SAA University & Wellness è il primo business campus in Italia che unisce formazione manageriale, sport e networking in un ambiente esclusivo.",4,10,2225
https://www.ronchiverdi.it/pt,I NOSTRI PERSONAL TRAINER | Ronchiverdi,"Scopri il nostro team di esperti qualificati, pronti a supportarti nel raggiungimento dei tuoi obiettivi di benessere e performance. Offriamo percorsi personalizzati in fitness, rieducazione funzionale, triathlon e sport di endurance. Ogni trainer è specializzato in diverse aree, garantendo un approccio su misura per ogni esigenza. Contattaci per iniziare il tuo percorso verso il benessere.",1,46,7493
https://www.ronchiverdi.it/saa-flex,LANDING SAA | Ronchiverdi,"Il primo campus in Italia che integra formazione manageriale, sport e benessere, dedicato esclusivamente agli studenti della SAA School of Management.",1,2,114
https://www.ronchiverdi.it/copia-di-lead-eventi,LEAD FESTA DELLA DONNA | Ronchiverdi,"Partecipa a un evento Ronchiverdi e ricevi una giornata omaggio nel club sportivo più esclusivo di Torino. Scopri fitness, piscina, tennis e area wellness.",1,2,1835
https://www.ronchiverdi.it/chinesis,CHINESIS | Ronchiverdi,"Chinesis Postural Lab è il centro di Ronchiverdi dedicato al benessere fisico attraverso la rieducazione del movimento, la prevenzione e il recupero funzionale. Offriamo percorsi personalizzati che includono valutazioni posturali, trattamenti osteopatici, massaggi terapeutici, Pilates Reformer, panca posturale e rieducazione funzionale. Ideale per chi pratica sport a livello avanzato o desidera migliorare la propria postura e mobilità",11,10,2439
https://www.ronchiverdi.it/area-kids,YOUNG SCHOOL | Ronchiverdi,"Offriamo un ambiente stimolante e sicuro per bambini e ragazzi, con attività sportive, laboratori creativi e percorsi educativi. Dalle scuole di tennis, nuoto, padel e triathlon, al Summer Sport Camp ""Il Giro del Mondo"", ogni proposta è pensata per favorire lo sviluppo fisico, sociale e personale dei più giovani.",5,6,789
https://www.ronchiverdi.it/menu-caffetteria,MENU CAFFETTERIA | Ronchiverdi,"Scopri la nostra selezione di caffè, bevande calde e fredde, dolci artigianali e snack, preparati con ingredienti freschi e di qualità. Perfetto per una pausa rilassante o un momento di convivialità. Visita la nostra caffetteria per un'esperienza unica.",6,1,3102
https://www.ronchiverdi.it,"Ronchiverdi | Club sportivo | Corso Moncalieri 466, 16, Torino, TO, Italia","Ronchiverdi è un club sportivo a Torino che offre una vasta gamma di attività per il benessere fisico e mentale, con spazi dedicati a fitness, sport, e relax. Scopri corsi, eventi e opportunità di networking in un ambiente esclusivo.",0,4,156
https://www.ronchiverdi.it/youngschool-non-soci,Kids Buy Esterni | Ronchiverdi,Scegli il programma Young school più adatti per i tuoi ragazzi!,5,4,1554
